Uuid,Void/Retire,Name,Description,_version:1
287463d3-2233-4c69-9851-5841a1f5e109,,OPD Visit,OPD Visit,
68391cec-08be-454d-8182-ff4e567de66d,,OPD Revisit,OPD Revisit,
78370d15-38ad-48a1-825f-f0e9ff60d5a1,,Group Session,Visit type for group sessions (used in Fast Data Entry),
e9650500-ead5-4b42-9a2a-a2f7a1c19211,,Dental Visit, Visit type for Dental,
232e222a-36a1-4cb2-8ef2-8a4ce7b43e67,,Laboratory Visit, Visit type for lab,
ae4af671-eb55-40a1-92f0-e441186575c2,,Pharmacy Visit, Visit type for pharmacy,
0408ada4-ba7a-4ee5-8052-01ea721e11eb,,Ultrasound Visit, Visit type for Ultrasound,
